HPitb1ch14-0001	Norvegia	CAPITOLO 14 NORBERTO, DORSORUGOSO DI NORVEGIA Ma Quirrell doveva essere più coraggioso di quanto credevano.
HPitb1ch14-0002	smunto	Nelle settimane successive sembrava farsi sempre più pallido e smunto, ma resisteva.
HPitb1ch14-0003	balbuzie	In quei giorni, ogni volta che Harry incrociava Quirrell, gli sorrideva come a incoraggiarlo e Ron aveva cominciato a rimproverare chiunque ridesse della balbuzie del professore.
HPitb1ch14-0004	programmare	Aveva cominciato a programmare i ripassi e a dividere i suoi appunti per argomenti attribuendo un colore diverso a ciascuno.
HPitb1ch14-0005	ripasso	Aveva cominciato a programmare i ripassi e a dividere i suoi appunti per argomenti attribuendo un colore diverso a ciascuno.
HPitb1ch14-0006	attribuire	Aveva cominciato a programmare i ripassi e a dividere i suoi appunti per argomenti attribuendo un colore diverso a ciascuno.
HPitb1ch14-0007	pungolare	A Harry e a Ron non sarebbe mai passato per la testa, ma lei continuava a pungolarli perché facessero lo stesso.
HPitb1ch14-0008	esame	«Ma, Hermione, agli esami mancano secoli!» «Dieci settimane» precisò impaziente Hermione, «dieci settimane non sono secoli, e per Nicolas Flamel non sono che un attimo».
HPitb1ch14-0009	seicento	«Ma noi non abbiamo seicento anni come Flamel» le ricordò Ron.
HPitb1ch14-0010	ripassare	«E comunque, si può sapere a che cosa ti serve ripassare, visto che sai già tutto?
HPitb1ch14-0011	Pasqua	Li caricarono di tanti compiti, che, quanto a divertimento, le vacanze di Pasqua non assomigliarono neanche lontanamente a quelle di Natale.
HPitb1ch14-0012	lontanamente	Li caricarono di tanti compiti, che, quanto a divertimento, le vacanze di Pasqua non assomigliarono neanche lontanamente a quelle di Natale.
HPitb1ch14-0013	rilassarsi	Era difficile rilassarsi con Hermione accanto che recitava i dodici usi del sangue di drago e si esercitava ad agitare la bacchetta.
HPitb1ch14-0014	nostalgico	«Questo non riuscirò mai a ricordarmelo» sbottò Ron un pomeriggio, gettando la penna d’oca e guardando nostalgico fuori dalla finestra della biblioteca.
HPitb1ch14-0015	petalo	Il cielo era azzurro chiaro, come i petali di un nontiscordardimé, e nell’aria aleggiava il profumo dell’estate imminente.
HPitb1ch14-0016	nontiscordardimé	Il cielo era azzurro chiaro, come i petali di un nontiscordardimé, e nell’aria aleggiava il profumo dell’estate imminente.
HPitb1ch14-0017	ambiguo	«Do solo un’occhiata» disse con un tono ambiguo che attrasse subito la loro attenzione.
HPitb1ch14-0018	sospettoso	«Voi, piuttosto, che cosa ci fate qui?» Di colpo, parve farsi sospettoso.
HPitb1ch14-0019	frugare	Guardate, non vi prometto niente, ma voi piantatela di frugare qua dentro;
HPitb1ch14-0020	pensieroso	» chiese Hermione pensierosa.
HPitb1ch14-0021	consultare	«Hagrid stava consultando la letteratura sui draghi!
HPitb1ch14-0022	letteratura	«Hagrid stava consultando la letteratura sui draghi!
HPitb1ch14-0023	Irlanda	Specie di draghi della Gran Bretagna e dell’Irlanda... Dall’uovo agli inferi:
HPitb1ch14-0024	inferi	Specie di draghi della Gran Bretagna e dell’Irlanda... Dall’uovo agli inferi:
HPitb1ch14-0025	pratico	guida pratica per l’allevatore di draghi».
HPitb1ch14-0026	allevatore	guida pratica per l’allevatore di draghi».
HPitb1ch14-0027	legge	«Ma è contro le nostre leggi» disse Ron.
HPitb1ch14-0028	allevamento	«L’allevamento di draghi è stato dichiarato fuori legge dalla Convenzione degli Stregoni del 1709, questo lo sanno tutti.
HPitb1ch14-0029	convenzione	«L’allevamento di draghi è stato dichiarato fuori legge dalla Convenzione degli Stregoni del 1709, questo lo sanno tutti.
HPitb1ch14-0030	addomesticare	È difficile non farsi notare dai Babbani se teniamo un drago nel giardino sul retro, e comunque non si possono addomesticare:
HPitb1ch14-0031	bruciatura	Dovreste vedere le bruciature che si è beccato Charlie in Romania coi draghi selvatici».
HPitb1ch14-0032	selvatico	Dovreste vedere le bruciature che si è beccato Charlie in Romania coi draghi selvatici».
HPitb1ch14-0033	gallese	«Il Gallese Comune Verde e il Nero delle Ebridi.
HPitb1ch14-0034	affinché	E noi maghi dobbiamo continuare a fare incantesimi sui Babbani che li hanno intravisti, affinché ne perdano il ricordo».
HPitb1ch14-0035	ermellino	Hagrid preparò del tè per i ragazzi e offrì loro panini al prosciutto di ermellino, che rifiutarono.
HPitb1ch14-0036	adulare	Tu sai tutto quel che avviene a Hogwarts» lo adulò Hermione con voce calda e suadente.
HPitb1ch14-0037	suadente	Tu sai tutto quel che avviene a Hogwarts» lo adulò Hermione con voce calda e suadente.
HPitb1ch14-0038	elencare	la professoressa Sprout... il professor Flitwick... la professoressa McGonagall...» e mentre li elencava li contava sulle dita, «il professor Quirrell... e naturalmente anche Silente ha fatto qualcosa.
HPitb1ch14-0039	sistema	Se Piton era stato coinvolto nella protezione della Pietra, non doveva aver avuto difficoltà a scoprire quali sistemi di sorveglianza avessero escogitato gli altri insegnanti.
HPitb1ch14-0040	escogitare	Se Piton era stato coinvolto nella protezione della Pietra, non doveva aver avuto difficoltà a scoprire quali sistemi di sorveglianza avessero escogitato gli altri insegnanti.
HPitb1ch14-0041	anima	» «Non lo sa anima viva, solo io e Silente» disse Hagrid tutto fiero.
HPitb1ch14-0042	sbieco	Harry notò che lanciava un’occhiata di sbieco al focolare.
HPitb1ch14-0043	giocherellare	«Oh» disse Hagrid giocherellando nervosamente con la sua barba.
HPitb1ch14-0044	goccio	Sono sceso al villaggio per farmi un goccetto e mi sono messo a giocare a carte con un tizio che non conoscevo.
HPitb1ch14-0045	disfarsi	Anzi, a dir la verità mi pareva che era molto contento di disfarsene».
HPitb1ch14-0046	schiudersi	«Ma che cosa farai, quando si schiude?» chiese Hermione.
HPitb1ch14-0047	hobby	Allevare draghi per lavoro e per hobby... Naturalmente è un po’ vecchiotto, ma dentro c’è proprio tutto.
HPitb1ch14-0048	secchio	Bisogna tenere l’uovo sul fuoco, perché a quanto pare le mamme drago scaldano i loro piccoli col fiato... Poi, quando si schiude, ogni mezz’ora bisogna dare al piccolo un secchio di brandy mescolato a sangue di pollo.
HPitb1ch14-0049	mescolare	Bisogna tenere l’uovo sul fuoco, perché a quanto pare le mamme drago scaldano i loro piccoli col fiato... Poi, quando si schiude, ogni mezz’ora bisogna dare al piccolo un secchio di brandy mescolato a sangue di pollo.
HPitb1ch14-0050	attizzare	Canticchiava allegramente mentre attizzava il fuoco.
HPitb1ch14-0051	illegalmente	E così, adesso avevano un’altra cosa di cui preoccuparsi, e cioè quel che sarebbe potuto accadere a Hagrid se qualcuno avesse scoperto che nascondeva illegalmente un drago nella sua capanna.
HPitb1ch14-0052	sgobbare	«Mi domando com’è vivere una vita tranquilla» sospirò Ron, una delle tante sere di fila che passarono a sgobbare sulla montagna di compiti che gli erano stati assegnati.
HPitb1ch14-0053	compilare	Ormai Hermione aveva cominciato a compilare programmi di ripasso anche per Harry e Ron, facendoli diventare matti.
HPitb1ch14-0054	cacciarsi	Ci cacceremo nei guai, ed è ancora niente in confronto a quel che capiterà a Hagrid quando si scoprirà quel che sta facendo!
HPitb1ch14-0055	recarsi	Ron e Hermione litigarono per tutto il tragitto fino all’aula di Erbologia e alla fine la ragazza acconsentì a recarsi da Hagrid con gli altri due durante la ricreazione.
HPitb1ch14-0056	campana	Quando si udì la campana del castello che annunciava la fine della lezione, tutti e tre lasciarono cadere contemporaneamente gli attrezzi da giardinaggio e si affrettarono ad attraversare il parco fino al margine della Foresta.
HPitb1ch14-0057	attrezzo	Quando si udì la campana del castello che annunciava la fine della lezione, tutti e tre lasciarono cadere contemporaneamente gli attrezzi da giardinaggio e si affrettarono ad attraversare il parco fino al margine della Foresta.
HPitb1ch14-0058	giardinaggio	Quando si udì la campana del castello che annunciava la fine della lezione, tutti e tre lasciarono cadere contemporaneamente gli attrezzi da giardinaggio e si affrettarono ad attraversare il parco fino al margine della Foresta.
HPitb1ch14-0059	margine	Quando si udì la campana del castello che annunciava la fine della lezione, tutti e tre lasciarono cadere contemporaneamente gli attrezzi da giardinaggio e si affrettarono ad attraversare il parco fino al margine della Foresta.
HPitb1ch14-0060	crepa	L’uovo era posato sul tavolo, inciso da crepe profonde:
HPitb1ch14-0061	seggiola	Tutti trascinarono le seggiole vicino al tavolo e stettero a guardare col fiato sospeso.
HPitb1ch14-0062	raschiare	A un tratto si udì raschiare e l’uovo si spaccò in due.
HPitb1ch14-0063	spaccarsi	A un tratto si udì raschiare e l’uovo si spaccò in due.
HPitb1ch14-0064	pece	Le ali, coperte da aculei, erano enormi a confronto del corpicino esile e nero come la pece.
HPitb1ch14-0065	allungato	Aveva il muso allungato, narici larghe, due cornini appena accennati e sporgenti occhi arancioni.
HPitb1ch14-0066	adorabile	«Non è adorabile?
HPitb1ch14-0067	benedire	«Che Dio lo benedica... guardate, riconosce la mamma!» disse Hagrid.
HPitb1ch14-0068	tendina	» «C’era qualcuno che spiava attraverso le tendine... un ragazzino... è partito di corsa verso la scuola».
HPitb1ch14-0069	stampato	Nel sorrisetto beffardo che Malfoy portò stampato in faccia per tutta la settimana seguente c’era qualcosa che innervosiva molto Harry, Ron e Hermione.
HPitb1ch14-0070	innervosire	Nel sorrisetto beffardo che Malfoy portò stampato in faccia per tutta la settimana seguente c’era qualcosa che innervosiva molto Harry, Ron e Hermione.
HPitb1ch14-0071	ragionare	I tre passarono gran parte del tempo libero nella capanna semibuia di Hagrid, cercando di farlo ragionare.
HPitb1ch14-0072	triplicarsi	Nel giro di una settimana la sua lunghezza si era già triplicata.
HPitb1ch14-0073	voluta	Dalle narici continuavano a uscirgli volute di fumo.
HPitb1ch14-0074	trascurare	Hagrid aveva trascurato i suoi doveri di guardacaccia, tanto aveva da fare con il drago.
HPitb1ch14-0075	spifferare	Malfoy potrebbe andare a spifferare tutto a Silente in qualsiasi momento».
HPitb1ch14-0076	allarmarsi	«Stai diventando matto pure tu» si allarmò Ron.
HPitb1ch14-0077	geniale	» «Geniale!» esclamò Ron.
HPitb1ch14-0078	divorare	Era stato giù alla capanna di Hagrid per aiutarlo a dar da mangiare a Norberto, che adesso divorava topi morti a carrettate.
HPitb1ch14-0079	carrettata	Era stato giù alla capanna di Hagrid per aiutarlo a dar da mangiare a Norberto, che adesso divorava topi morti a carrettate.
HPitb1ch14-0080	fasciato	disse mostrando loro la mano fasciata in un fazzoletto insanguinato.
HPitb1ch14-0081	insanguinare	disse mostrando loro la mano fasciata in un fazzoletto insanguinato.
HPitb1ch14-0082	coniglietto	quel drago è l’animale più terribile che ho mai visto, ma da come lo tratta Hagrid, si direbbe un tenero coniglietto.
HPitb1ch14-0083	ninnananna	E quando sono uscito gli stava cantando la ninnananna».
HPitb1ch14-0084	clandestino	Il problema è che non possono essere visti mentre trasportano un drago clandestino.
HPitb1ch14-0085	affetto	Con affetto,  Charlie  Si guardarono.
HPitb1ch14-0086	intoppo	Ma vi fu un intoppo.
HPitb1ch14-0087	condizione	A fine giornata, Harry e Hermione si precipitarono in infermeria dove trovarono Ron a letto, in condizioni pietose.
HPitb1ch14-0088	pietoso	A fine giornata, Harry e Hermione si precipitarono in infermeria dove trovarono Ron a letto, in condizioni pietose.
HPitb1ch14-0089	calmare	Harry e Hermione cercarono di calmarlo.
HPitb1ch14-0090	tranquillizzare	«Entro la mezzanotte di sabato sarà tutto finito» disse Hermione, ma la cosa non parve tranquillizzarlo minimamente.
HPitb1ch14-0091	minimamente	«Entro la mezzanotte di sabato sarà tutto finito» disse Hermione, ma la cosa non parve tranquillizzarlo minimamente.
HPitb1ch14-0092	sudare	Anzi, Ron si tirò su a sedere e cominciò a sudare.
HPitb1ch14-0093	roco	«A mezzanotte di sabato!» esclamò con voce roca.
HPitb1ch14-0094	bendare	Quando andarono da Hagrid per riferirgli tutto, trovarono Zanna, il suo danese, seduto fuori dalla porta con la coda bendata.
HPitb1ch14-0095	dispetto	«Norberto è in vena di dispetti... ma io so bene come trattarlo».
HPitb1ch14-0096	tennis	Era una notte molto buia e nuvolosa e arrivarono alla capanna con un po’ di ritardo perché si erano attardati nella Sala d’Ingresso ad aspettare che Peeves la smettesse di giocare a tennis contro il muro e si togliesse di torno.
HPitb1ch14-0097	orsacchiotto	«E anche il suo orsacchiotto, se mai si sente solo».
HPitb1ch14-0098	neppure	neppure la scorciatoia che conosceva Harry servì a facilitare il compito.
HPitb1ch14-0099	facilitare	neppure la scorciatoia che conosceva Harry servì a facilitare il compito.
HPitb1ch14-0100	sagoma	Dimenticando di essere invisibili, si ritrassero nell’ombra e rimasero a guardare le sagome scure di due persone impegnate in un corpo a corpo a tre metri da loro.
HPitb1ch14-0101	lume	A un tratto si accese un lume.
HPitb1ch14-0102	scozzese	Era la professoressa McGonagall, in vestaglia scozzese e retina per i capelli, che teneva saldamente Malfoy per un orecchio.
HPitb1ch14-0103	retina	Era la professoressa McGonagall, in vestaglia scozzese e retina per i capelli, che teneva saldamente Malfoy per un orecchio.
HPitb1ch14-0104	punizione	«In punizione!» gridò.
HPitb1ch14-0105	panzana	Come osi raccontare simili panzane!
HPitb1ch14-0106	respirare	Soltanto quando furono usciti fuori nell’aria fredda della notte si tolsero di dosso il Mantello, lieti di poter finalmente tornare a respirare come si deve.
HPitb1ch14-0107	ridersi	Sempre ridendosela per la sorte di Malfoy, rimasero in attesa, mentre Norberto si agitava nella sua cassa.
HPitb1ch14-0108	finimenti	Mostrarono a Harry e a Hermione i finimenti che avevano fabbricato in modo da poter volare con Norberto sospeso fra loro.
HPitb1ch14-0109	sostegno	Tutti diedero una mano per assicurare la cassa a quei sostegni, e alla fine Harry e Hermione strinsero la mano agli altri ringraziandoli sentitamente.
HPitb1ch14-0110	sentitamente	Tutti diedero una mano per assicurare la cassa a quei sostegni, e alla fine Harry e Hermione strinsero la mano agli altri ringraziandoli sentitamente.
HPitb1ch14-0111	ridiscendere	Ora che si erano liberati di lui, ridiscesero lungo la scala a chiocciola col cuore leggero.
