HPfrb1ch05-0001	traverse        	LE CHEMIN DE TRAVERSE Harry se réveilla de bonne heure le lendemain matin.
HPfrb1ch05-0002	fermer          	Il savait qu’il faisait jour, mais il garda les yeux fermés.
HPfrb1ch05-0003	nommer          	Dans un demi-sommeil, il se demanda s’il n’avait pas rêvé, si le géant nommé Hagrid existait bien, s’il n’allait pas se retrouver dans son placard lorsqu’il ouvrirait les yeux.
HPfrb1ch05-0004	exister         	Dans un demi-sommeil, il se demanda s’il n’avait pas rêvé, si le géant nommé Hagrid existait bien, s’il n’allait pas se retrouver dans son placard lorsqu’il ouvrirait les yeux.
HPfrb1ch05-0005	désespéré       	– C’est bien ce que je pensais, marmonna-t-il, désespéré.
HPfrb1ch05-0006	cogne           	Voilà la tante Pétunia qui cogne à la porte du placard pour me réveiller.
HPfrb1ch05-0007	résigner        	Résigné, il ouvrit les yeux et se redressa.
HPfrb1ch05-0008	illuminer       	Le gros manteau de Hagrid glissa de ses épaules et il vit l’intérieur de la cabane illuminé de soleil.
HPfrb1ch05-0009	patte           	Hagrid dormait toujours sur le canapé écrasé et Harry aperçut un hibou qui tapait d’une patte au carreau de la fenêtre, un journal dans le bec.
HPfrb1ch05-0010	carreau         	Hagrid dormait toujours sur le canapé écrasé et Harry aperçut un hibou qui tapait d’une patte au carreau de la fenêtre, un journal dans le bec.
HPfrb1ch05-0011	sensation       	Il éprouvait une telle sensation de bonheur qu’il avait l’impression de sentir son corps flotter comme un ballon.
HPfrb1ch05-0012	bonheur         	Il éprouvait une telle sensation de bonheur qu’il avait l’impression de sentir son corps flotter comme un ballon.
HPfrb1ch05-0013	uniquement      	Le manteau du géant semblait être constitué uniquement de poches – on y trouvait des trousseaux de clés, du produit contre les limaces, des pelotes de ficelle, des bonbons à la menthe, des sachets de thé… Harry finit par dénicher une poignée de pièces de monnaie qui lui semblèrent bizarres.
HPfrb1ch05-0014	trousseau       	Le manteau du géant semblait être constitué uniquement de poches – on y trouvait des trousseaux de clés, du produit contre les limaces, des pelotes de ficelle, des bonbons à la menthe, des sachets de thé… Harry finit par dénicher une poignée de pièces de monnaie qui lui semblèrent bizarres.
HPfrb1ch05-0015	produit         	Le manteau du géant semblait être constitué uniquement de poches – on y trouvait des trousseaux de clés, du produit contre les limaces, des pelotes de ficelle, des bonbons à la menthe, des sachets de thé… Harry finit par dénicher une poignée de pièces de monnaie qui lui semblèrent bizarres.
HPfrb1ch05-0016	pelote          	Le manteau du géant semblait être constitué uniquement de poches – on y trouvait des trousseaux de clés, du produit contre les limaces, des pelotes de ficelle, des bonbons à la menthe, des sachets de thé… Harry finit par dénicher une poignée de pièces de monnaie qui lui semblèrent bizarres.
HPfrb1ch05-0017	ficelle         	Le manteau du géant semblait être constitué uniquement de poches – on y trouvait des trousseaux de clés, du produit contre les limaces, des pelotes de ficelle, des bonbons à la menthe, des sachets de thé… Harry finit par dénicher une poignée de pièces de monnaie qui lui semblèrent bizarres.
HPfrb1ch05-0018	menthe          	Le manteau du géant semblait être constitué uniquement de poches – on y trouvait des trousseaux de clés, du produit contre les limaces, des pelotes de ficelle, des bonbons à la menthe, des sachets de thé… Harry finit par dénicher une poignée de pièces de monnaie qui lui semblèrent bizarres.
HPfrb1ch05-0019	sachet          	Le manteau du géant semblait être constitué uniquement de poches – on y trouvait des trousseaux de clés, du produit contre les limaces, des pelotes de ficelle, des bonbons à la menthe, des sachets de thé… Harry finit par dénicher une poignée de pièces de monnaie qui lui semblèrent bizarres.
HPfrb1ch05-0020	poignée         	Le manteau du géant semblait être constitué uniquement de poches – on y trouvait des trousseaux de clés, du produit contre les limaces, des pelotes de ficelle, des bonbons à la menthe, des sachets de thé… Harry finit par dénicher une poignée de pièces de monnaie qui lui semblèrent bizarres.
HPfrb1ch05-0021	monnaie         	Le manteau du géant semblait être constitué uniquement de poches – on y trouvait des trousseaux de clés, du produit contre les limaces, des pelotes de ficelle, des bonbons à la menthe, des sachets de thé… Harry finit par dénicher une poignée de pièces de monnaie qui lui semblèrent bizarres.
HPfrb1ch05-0022	ensommeiller    	– Donne-lui cinq Noises, dit Hagrid d’une voix ensommeillée.
HPfrb1ch05-0023	bronze          	– Les petites pièces en bronze.
HPfrb1ch05-0024	bourse          	L’oiseau tendit une patte et Harry déposa cinq Noises dans la petite bourse en cuir qui y était attachée.
HPfrb1ch05-0025	attacher        	L’oiseau tendit une patte et Harry déposa cinq Noises dans la petite bourse en cuir qui y était attachée.
HPfrb1ch05-0026	envoler         	Le hibou s’envola aussitôt par la fenêtre.
HPfrb1ch05-0027	bâillement      	– On ferait bien d’y aller, dit Hagrid qui se redressa avec un bâillement sonore.
HPfrb1ch05-0028	crever          	Il avait l’air soudain préoccupé, comme si le bonheur qu’il avait ressenti venait de crever comme un ballon.
HPfrb1ch05-0029	heu             	– Heu… Hagrid ?
HPfrb1ch05-0030	banque          	C’est la banque des sorciers.
HPfrb1ch05-0031	mange           	Mange donc une saucisse.
HPfrb1ch05-0032	clair           	Le ciel était clair, à présent et la mer étincelait sous le soleil.
HPfrb1ch05-0033	louer           	La barque que l’oncle Vernon avait louée était toujours là, inondée d’eau de pluie.
HPfrb1ch05-0034	embarcation     	demanda Harry en cherchant des yeux une autre embarcation.
HPfrb1ch05-0035	ramer           	– C’est quand même un peu idiot de ramer, dit le géant en lançant à Harry un regard de côté.
HPfrb1ch05-0036	accélérer       	Si je m’arrange pour… accélérer un peu les choses, tu n’en parleras pas quand tu seras à Poudlard ?
HPfrb1ch05-0037	pointe          	Hagrid tapota alors de la pointe de son parapluie rose le bord de la barque et le bateau fila aussitôt vers le rivage.
HPfrb1ch05-0038	rivage          	Hagrid tapota alors de la pointe de son parapluie rose le bord de la barque et le bateau fila aussitôt vers le rivage.
HPfrb1ch05-0039	sort            	– Ils n’ont pas leur pareil pour jeter des sorts, répondit Hagrid en dépliant son journal.
HPfrb1ch05-0040	dragon          	On dit même que ce sont des dragons qui gardent la salle des coffres.
HPfrb1ch05-0041	coffre          	On dit même que ce sont des dragons qui gardent la salle des coffres.
HPfrb1ch05-0042	kilomètre       	Et en plus, ce n’est pas facile d’y retrouver son chemin – Gringotts est à des kilomètres en sous-sol, bien plus bas que le métro de Londres.
HPfrb1ch05-0043	gazette         	Harry resta assis en silence pendant que Hagrid lisait son journal, La Gazette du sorcier.
HPfrb1ch05-0044	contact         	Harry avait appris au contact de l’oncle Vernon qu’il ne fallait jamais déranger quelqu’un qui lit son journal, mais il avait tant de questions à poser qu’il était très difficile de résister.
HPfrb1ch05-0045	ministère       	Le ministère de la Magie a encore fait des bêtises, comme d’habitude, marmonna Hagrid en tournant les pages.
HPfrb1ch05-0046	page            	Le ministère de la Magie a encore fait des bêtises, comme d’habitude, marmonna Hagrid en tournant les pages.
HPfrb1ch05-0047	spontanément    	demanda spontanément Harry.
HPfrb1ch05-0048	ministre        	Ils voulaient nommer Dumbledore ministre, mais il ne quitterait Poudlard pour rien au monde et c’est ce vieux gâteux de Cornelius Fudge qui a hérité du poste.
HPfrb1ch05-0049	gâteux          	Ils voulaient nommer Dumbledore ministre, mais il ne quitterait Poudlard pour rien au monde et c’est ce vieux gâteux de Cornelius Fudge qui a hérité du poste.
HPfrb1ch05-0050	gaffeur         	Un vrai gaffeur, celui-là.
HPfrb1ch05-0051	conseil         	Chaque matin, il envoie un hibou à Dumbledore pour lui demander conseil.
HPfrb1ch05-0052	appel           	Sinon, ils essaieraient de faire appel à nous pour résoudre leurs problèmes.
HPfrb1ch05-0053	résoudre        	Sinon, ils essaieraient de faire appel à nous pour résoudre leurs problèmes.
HPfrb1ch05-0054	quai            	À ce moment, le bateau heurta en douceur le quai du port.
HPfrb1ch05-0055	port            	À ce moment, le bateau heurta en douceur le quai du port.
HPfrb1ch05-0056	replier         	Hagrid replia son journal et ils montèrent l’escalier de pierre qui menait à la rue.
HPfrb1ch05-0057	gare            	Tout au long du chemin qui conduisait à la gare, les passants se retournaient sur Hagrid : il était deux fois plus grand que la moyenne et ne cessait de faire des commentaires à haute voix sur tout ce qu’il voyait.
HPfrb1ch05-0058	commentaire     	Tout au long du chemin qui conduisait à la gare, les passants se retournaient sur Hagrid : il était deux fois plus grand que la moyenne et ne cessait de faire des commentaires à haute voix sur tout ce qu’il voyait.
HPfrb1ch05-0059	parcmètre       	– Regarde ça, disait-il en montrant des parcmètres.
HPfrb1ch05-0060	inventer        	Les Moldus ont vraiment l’esprit tordu pour inventer des trucs pareils !
HPfrb1ch05-0061	essouffler      	demanda-t-il, un peu essoufflé.
HPfrb1ch05-0062	méduse          	Sac à méduses, j’aimerais bien avoir un dragon !
HPfrb1ch05-0063	soin            	Hagrid, qui ne comprenait rien à « l’argent des Moldus » confia à Harry le soin d’acheter les billets.
HPfrb1ch05-0064	passager        	Dans le train, les passagers ouvraient des yeux ronds en voyant Hagrid.
HPfrb1ch05-0065	siège           	Il occupait deux sièges à lui tout seul et tricotait quelque chose qui ressemblait à un chapiteau de cirque jaune canari.
HPfrb1ch05-0066	tricoter        	Il occupait deux sièges à lui tout seul et tricotait quelque chose qui ressemblait à un chapiteau de cirque jaune canari.
HPfrb1ch05-0067	chapiteau       	Il occupait deux sièges à lui tout seul et tricotait quelque chose qui ressemblait à un chapiteau de cirque jaune canari.
HPfrb1ch05-0068	cirque          	Il occupait deux sièges à lui tout seul et tricotait quelque chose qui ressemblait à un chapiteau de cirque jaune canari.
HPfrb1ch05-0069	canari          	Il occupait deux sièges à lui tout seul et tricotait quelque chose qui ressemblait à un chapiteau de cirque jaune canari.
HPfrb1ch05-0070	maille          	– Tu as toujours ta lettre, Harry ? demanda-t-il en comptant les mailles.
HPfrb1ch05-0071	fourniture      	Regarde un peu la liste des fournitures.
HPfrb1ch05-0072	feuille         	Elle contenait une autre feuille qu’il n’avait pas remarquée auparavant.
HPfrb1ch05-0073	obligatoirement 	Liste des vêtements dont les élèves de première année devront obligatoirement être équipés :
HPfrb1ch05-0074	équiper         	Liste des vêtements dont les élèves de première année devront obligatoirement être équipés :
HPfrb1ch05-0075	modèle          	1) Trois robes de travail (noires), modèle normal
HPfrb1ch05-0076	pointu          	2) Un chapeau pointu (noir)
HPfrb1ch05-0077	protecteur      	3) Une paire de gants protecteurs (en cuir de dragon ou autre matière semblable)
HPfrb1ch05-0078	matière         	3) Une paire de gants protecteurs (en cuir de dragon ou autre matière semblable)
HPfrb1ch05-0079	hiver           	4) Une cape d’hiver (noire avec attaches d’argent)
HPfrb1ch05-0080	noire           	4) Une cape d’hiver (noire avec attaches d’argent)
HPfrb1ch05-0081	attache         	4) Une cape d’hiver (noire avec attaches d’argent)
HPfrb1ch05-0082	étiquette       	Chaque vêtement devra porter une étiquette indiquant le nom de l’élève.
HPfrb1ch05-0083	manuel          	Livres et manuels
HPfrb1ch05-0084	procurer        	Chaque élève devra se procurer un exemplaire des ouvrages suivants :
HPfrb1ch05-0085	exemplaire      	Chaque élève devra se procurer un exemplaire des ouvrages suivants :
HPfrb1ch05-0086	enchantement    	Le Livre des sorts et enchantements (niveau 1), de Miranda Fauconnette
HPfrb1ch05-0087	théorique       	Magie théorique, de Adalbert Lasornette
HPfrb1ch05-0088	métamorphose    	Manuel de métamorphose à l’usage des débutants, de Emeric G. Changé
HPfrb1ch05-0089	débutant        	Manuel de métamorphose à l’usage des débutants, de Emeric G. Changé
HPfrb1ch05-0090	herbe           	Mille herbes et champignons magiques, de Phyllida Augirolle
HPfrb1ch05-0091	champignon      	Mille herbes et champignons magiques, de Phyllida Augirolle
HPfrb1ch05-0092	potion          	Potions magiques, de Arsenius Beaulitron
HPfrb1ch05-0093	habitat         	Vie et habitat des animaux fantastiques, de Norbert Dragonneau
HPfrb1ch05-0094	fantastique     	Vie et habitat des animaux fantastiques, de Norbert Dragonneau
HPfrb1ch05-0095	obscur          	Forces obscures : comment s’en protéger, de Quentin Jentremble
HPfrb1ch05-0096	chaudron        	1 chaudron (modèle standard en étain, taille 2)
HPfrb1ch05-0097	standard        	1 chaudron (modèle standard en étain, taille 2)
HPfrb1ch05-0098	étain           	1 chaudron (modèle standard en étain, taille 2)
HPfrb1ch05-0099	fiole           	1 boîte de fioles en verre ou cristal
HPfrb1ch05-0100	cristal         	1 boîte de fioles en verre ou cristal
HPfrb1ch05-0101	télescope       	1 télescope
HPfrb1ch05-0102	balance         	1 balance en cuivre
HPfrb1ch05-0103	balai           	IL EST RAPPELÉ AUX PARENTS QUE LES ÉLÈVES DE PREMIÈRE ANNÉE NE SONT PAS AUTORISÉS À POSSÉDER LEUR PROPRE BALAI.
HPfrb1ch05-0104	transport       	Hagrid semblait connaître son chemin mais, de toute évidence, il n’avait pas l’habitude de se déplacer dans les transports en commun.
HPfrb1ch05-0105	commun          	Hagrid semblait connaître son chemin mais, de toute évidence, il n’avait pas l’habitude de se déplacer dans les transports en commun.
HPfrb1ch05-0106	coincer         	Il resta coincé dans le portillon automatique du métro et se plaignit d’une voix tonitruante que les sièges étaient trop petits et les rames trop lentes.
HPfrb1ch05-0107	portillon       	Il resta coincé dans le portillon automatique du métro et se plaignit d’une voix tonitruante que les sièges étaient trop petits et les rames trop lentes.
HPfrb1ch05-0108	automatique     	Il resta coincé dans le portillon automatique du métro et se plaignit d’une voix tonitruante que les sièges étaient trop petits et les rames trop lentes.
HPfrb1ch05-0109	tonitruant      	Il resta coincé dans le portillon automatique du métro et se plaignit d’une voix tonitruante que les sièges étaient trop petits et les rames trop lentes.
HPfrb1ch05-0110	rame            	Il resta coincé dans le portillon automatique du métro et se plaignit d’une voix tonitruante que les sièges étaient trop petits et les rames trop lentes.
HPfrb1ch05-0111	lent            	Il resta coincé dans le portillon automatique du métro et se plaignit d’une voix tonitruante que les sièges étaient trop petits et les rames trop lentes.
HPfrb1ch05-0112	roulant         	– Je ne sais pas comment font les Moldus sans la magie, dit-il tandis qu’ils escaladaient un escalier roulant en panne qui menait à une rue animée, bordée de magasins.
HPfrb1ch05-0113	panne           	– Je ne sais pas comment font les Moldus sans la magie, dit-il tandis qu’ils escaladaient un escalier roulant en panne qui menait à une rue animée, bordée de magasins.
HPfrb1ch05-0114	border          	– Je ne sais pas comment font les Moldus sans la magie, dit-il tandis qu’ils escaladaient un escalier roulant en panne qui menait à une rue animée, bordée de magasins.
HPfrb1ch05-0115	dense           	Sur les trottoirs, la foule était dense, mais Hagrid était si grand qu’il n’avait aucun mal à se frayer un chemin et Harry restait prudemment dans son sillage.
HPfrb1ch05-0116	frayer          	Sur les trottoirs, la foule était dense, mais Hagrid était si grand qu’il n’avait aucun mal à se frayer un chemin et Harry restait prudemment dans son sillage.
HPfrb1ch05-0117	prudemment      	Sur les trottoirs, la foule était dense, mais Hagrid était si grand qu’il n’avait aucun mal à se frayer un chemin et Harry restait prudemment dans son sillage.
HPfrb1ch05-0118	sillage         	Sur les trottoirs, la foule était dense, mais Hagrid était si grand qu’il n’avait aucun mal à se frayer un chemin et Harry restait prudemment dans son sillage.
HPfrb1ch05-0119	librairie       	Ils passèrent devant des librairies, des magasins de disques, des stands de hamburgers et des cinémas, mais aucune boutique ne semblait vendre des baguettes magiques.
HPfrb1ch05-0120	disque          	Ils passèrent devant des librairies, des magasins de disques, des stands de hamburgers et des cinémas, mais aucune boutique ne semblait vendre des baguettes magiques.
HPfrb1ch05-0121	stand           	Ils passèrent devant des librairies, des magasins de disques, des stands de hamburgers et des cinémas, mais aucune boutique ne semblait vendre des baguettes magiques.
HPfrb1ch05-0122	enterrer        	Y avait-il vraiment des montagnes d’or magique enterrées à des kilomètres sous leurs pieds ?
HPfrb1ch05-0123	farce           	N’était-ce pas plutôt une farce énorme que lui avaient faite les Dursley ?
HPfrb1ch05-0124	humour          	Si Harry n’avait pas su que les Dursley ne possédaient pas le moindre sens de l’humour, il aurait pu le penser.
HPfrb1ch05-0125	net             	Soudain, Hagrid s’arrêta net.
HPfrb1ch05-0126	pub             	C’était un pub minuscule et miteux, coincé entre une grande librairie et une boutique de disques.
HPfrb1ch05-0127	miteux          	C’était un pub minuscule et miteux, coincé entre une grande librairie et une boutique de disques.
HPfrb1ch05-0128	xérès           	De vieilles femmes étaient assises dans un coin et buvaient de petits verres de xérès.
HPfrb1ch05-0129	fumer           	L’une d’elles fumait une longue pipe.
HPfrb1ch05-0130	pipe            	L’une d’elles fumait une longue pipe.
HPfrb1ch05-0131	barman          	Un petit homme en chapeau haut de forme parlait à un vieux barman chauve dont la tête ressemblait à une noix scintillante.
HPfrb1ch05-0132	noix            	Un petit homme en chapeau haut de forme parlait à un vieux barman chauve dont la tête ressemblait à une noix scintillante.
HPfrb1ch05-0133	scintillant     	Un petit homme en chapeau haut de forme parlait à un vieux barman chauve dont la tête ressemblait à une noix scintillante.
HPfrb1ch05-0134	rangée          	– Comme d’habitude, Hagrid ? demanda le barman en tendant la main vers une rangée de verres.
HPfrb1ch05-0135	fléchir         	Je suis en mission pour Poudlard, répondit le géant en donnant une tape sur l’épaule de Harry dont les genoux fléchirent sous le choc.
HPfrb1ch05-0136	seigneur        	– Seigneur Dieu, dit le barman en regardant Harry.
HPfrb1ch05-0137	client          	C’est… Est-ce que c’est vraiment ?… Soudain, les clients du Chaudron Baveur ne dirent plus un mot, ne firent plus un geste.
HPfrb1ch05-0138	honneur         	Harry Potter… Quel honneur !
HPfrb1ch05-0139	contourner      	Il se hâta de contourner le comptoir et se précipita sur Harry pour lui serrer la main.
HPfrb1ch05-0140	comptoir        	Il se hâta de contourner le comptoir et se précipita sur Harry pour lui serrer la main.
HPfrb1ch05-0141	bienvenu        	– Soyez le bienvenu, Mr Potter.
HPfrb1ch05-0142	racler          	Puis on entendit les chaises racler le plancher et, l’instant suivant, Harry se trouva entouré de gens qui tenaient à tout prix à lui serrer la main.
HPfrb1ch05-0143	bar             	Pas un seul client du bar n’était resté assis.
HPfrb1ch05-0144	connaissance    	– Je suis très fier de faire votre connaissance, dit quelqu’un d’autre.
HPfrb1ch05-0145	émouvoir        	Je suis si ému.
HPfrb1ch05-0146	honorer         	– Je suis si honoré de faire votre connaissance, Mr Potter, dit un quatrième.
HPfrb1ch05-0147	quatrième       	– Je suis si honoré de faire votre connaissance, Mr Potter, dit un quatrième.
HPfrb1ch05-0148	saluer          	Vous m’avez salué un jour dans un magasin.
HPfrb1ch05-0149	visiblement     	Un jeune homme au teint pâle s’avança, visiblement nerveux.
HPfrb1ch05-0150	tic             	L’une de ses paupières était agitée de tics.
HPfrb1ch05-0151	enseigner       	– Quelle matière enseignez-vous, professeur ?
HPfrb1ch05-0152	défense         	– La dé… défense contre les for… forces du Mal, marmonna le professeur Quirrell comme s’il eût préféré ne pas en parler.
HPfrb1ch05-0153	vampire         	Je… je dois moi-même a… acheter un nouveau li… livre sur les vampires.
HPfrb1ch05-0154	accaparer       	Les autres clients du bar n’avaient pas l’intention de laisser le professeur accaparer Harry, et Hagrid eut toutes les peines du monde à se faire entendre.
HPfrb1ch05-0155	remarquable     	C’est un esprit remarquable.
HPfrb1ch05-0156	harpie          	Il allait très bien tant qu’il étudiait dans les livres mais depuis qu’il est allé rencontrer des vampires et des harpies dans la Forêt noire, il a peur de tout, même de ses élèves.
HPfrb1ch05-0157	trembloter      	La brique se mit alors à trembloter et un petit trou apparut en son milieu.
HPfrb1ch05-0158	élargir         	Le trou s’élargit de plus en plus et se transforma bientôt en une arcade suffisamment grande pour permettre même à Hagrid de passer.
HPfrb1ch05-0159	arcade          	Le trou s’élargit de plus en plus et se transforma bientôt en une arcade suffisamment grande pour permettre même à Hagrid de passer.
HPfrb1ch05-0160	au-delà         	Au-delà, une rue pavée serpentait devant eux à perte de vue.
HPfrb1ch05-0161	paver           	Au-delà, une rue pavée serpentait devant eux à perte de vue.
HPfrb1ch05-0162	serpenter       	Au-delà, une rue pavée serpentait devant eux à perte de vue.
HPfrb1ch05-0163	perte           	Au-delà, une rue pavée serpentait devant eux à perte de vue.
HPfrb1ch05-0164	stupéfaction    	La stupéfaction de Harry le fit sourire.
HPfrb1ch05-0165	franchir        	Ils franchirent l’arcade qui disparut aussitôt sur leur passage pour ne laisser derrière eux que le mur de pierre.
HPfrb1ch05-0166	passage         	Ils franchirent l’arcade qui disparut aussitôt sur leur passage pour ne laisser derrière eux que le mur de pierre.
HPfrb1ch05-0167	étalage         	Le soleil brillait sur un étalage de chaudrons, devant un magasin.
HPfrb1ch05-0168	pancarte        	Une pancarte annonçait : « Chaudrons – toutes tailles – cuivre, étain, argent – touillage automatique – modèles pliables. »
HPfrb1ch05-0169	touiller        	Une pancarte annonçait : « Chaudrons – toutes tailles – cuivre, étain, argent – touillage automatique – modèles pliables. »
HPfrb1ch05-0170	pliable         	Une pancarte annonçait : « Chaudrons – toutes tailles – cuivre, étain, argent – touillage automatique – modèles pliables. »
HPfrb1ch05-0171	étal            	Harry aurait voulu avoir une demi-douzaine d’yeux supplémentaires, il regardait de tous côtés, en essayant de tout voir à la fois : les magasins, les étals, les gens qui faisaient leurs courses.
HPfrb1ch05-0172	rondelet        	Une petite femme rondelette regardait la vitrine d’un apothicaire en hochant la tête :
HPfrb1ch05-0173	vitrine         	Une petite femme rondelette regardait la vitrine d’un apothicaire en hochant la tête :
HPfrb1ch05-0174	apothicaire     	Une petite femme rondelette regardait la vitrine d’un apothicaire en hochant la tête :
HPfrb1ch05-0175	gramme          	– Dix-sept Mornilles pour trente grammes de foie de dragon, c’est de la folie… marmonna-t-elle.
HPfrb1ch05-0176	foie            	– Dix-sept Mornilles pour trente grammes de foie de dragon, c’est de la folie… marmonna-t-elle.
HPfrb1ch05-0177	folie           	– Dix-sept Mornilles pour trente grammes de foie de dragon, c’est de la folie… marmonna-t-elle.
HPfrb1ch05-0178	ululement       	Un ululement sourd s’éleva d’une boutique sombre dont l’enseigne indiquait : « Au Royaume du Hibou – hulottes, chouettes effraies, grands ducs, chouettes lapones. »
HPfrb1ch05-0179	enseigne        	Un ululement sourd s’éleva d’une boutique sombre dont l’enseigne indiquait : « Au Royaume du Hibou – hulottes, chouettes effraies, grands ducs, chouettes lapones. »
HPfrb1ch05-0180	royaume         	Un ululement sourd s’éleva d’une boutique sombre dont l’enseigne indiquait : « Au Royaume du Hibou – hulottes, chouettes effraies, grands ducs, chouettes lapones. »
HPfrb1ch05-0181	effraie         	Un ululement sourd s’éleva d’une boutique sombre dont l’enseigne indiquait : « Au Royaume du Hibou – hulottes, chouettes effraies, grands ducs, chouettes lapones.
HPfrb1ch05-0182	duc             	Un ululement sourd s’éleva d’une boutique sombre dont l’enseigne indiquait : « Au Royaume du Hibou – hulottes, chouettes effraies, grands ducs, chouettes lapones.
HPfrb1ch05-0183	lapon           	Un ululement sourd s’éleva d’une boutique sombre dont l’enseigne indiquait : « Au Royaume du Hibou – hulottes, chouettes effraies, grands ducs, chouettes lapones.
