HPfr16.txt-0001	hantise         	Longtemps encore, Harry se demanderait comment il avait pu faire pour passer ses examens tout en ayant sans cesse la hantise de voir Voldemort surgir dans la salle de classe.
HPfr16.txt-0002	utilisateur     	Les élèves avaient reçu des plumes neuves auxquelles on avait jeté un sort qui empêchait leurs utilisateurs de tricher.
HPfr16.txt-0003	tricher         	Les élèves avaient reçu des plumes neuves auxquelles on avait jeté un sort qui empêchait leurs utilisateurs de tricher.
HPfr16.txt-0004	pratique        	Il y eut aussi un examen pratique.
HPfr16.txt-0005	ananas          	Le professeur Flitwick les appela un par un dans sa classe pour voir s’ils arrivaient à faire danser un ananas sur une table.
HPfr16.txt-0006	tabatière       	Le professeur McGonagall les regarda transformer une souris en tabatière
HPfr16.txt-0007	amnésie         	Ils étaient tous paniqués devant Rogue qui les surveillait de près pendant qu’ils essayaient de fabriquer une potion d’Amnésie.
HPfr16.txt-0008	transpercer     	Harry fit de son mieux pour ne pas prêter attention aux douleurs qui, par instants, lui transperçaient le front depuis son aventure dans la forêt.
HPfr16.txt-0009	anxieux         	Neville pensait qu’il était anxieux à cause de ses examens, car il n’arrivait presque plus à dormir.
HPfr16.txt-0010	dégouliner      	Son vieux cauchemar le réveillait sans cesse, plus effrayant que jamais : aux images habituelles s’ajoutait celle d’une silhouette encapuchonnée, dégoulinante de sang de licorne.
HPfr16.txt-0011	souci           	Ron et Hermione n’avaient pas tous ces soucis ; c’est sans doute pourquoi ils paraissaient moins préoccupés que Harry par le sort de la Pierre.
HPfr16.txt-0012	absorber        	La pensée de Voldemort leur faisait peur, mais il n’était pas présent dans leurs rêves et ils étaient si absorbés par leurs révisions qu’ils n’avaient guère le temps de s’inquiéter des manigances de Rogue ou de quiconque d’autre.
HPfr16.txt-0013	manigance       	La pensée de Voldemort leur faisait peur, mais il n’était pas présent dans leurs rêves et ils étaient si absorbés par leurs révisions qu’ils n’avaient guère le temps de s’inquiéter des manigances de Rogue ou de quiconque d’autre.
HPfr16.txt-0014	inventeur       	Ils durent passer une heure à répondre à des questions concernant de vieux sorciers un peu fous, inventeurs de chaudrons dont le contenu tournait tout seul puis ils furent enfin libres pendant toute une semaine jusqu’aux résultats des examens.
HPfr16.txt-0015	code            	Je n’aurais même pas eu besoin d’apprendre le Code de conduite des loups-garous de 1637, ni l’ascension d’Elfric l’Insatiable.
HPfr16.txt-0016	ascension       	Je n’aurais même pas eu besoin d’apprendre le Code de conduite des loups-garous de 1637, ni l’ascension d’Elfric l’Insatiable.
HPfr16.txt-0017	insatiable      	Je n’aurais même pas eu besoin d’apprendre le Code de conduite des loups-garous de 1637, ni l’ascension d’Elfric l’Insatiable.
HPfr16.txt-0018	tentacule       	Les jumeaux Weasley chatouillaient les tentacules d’un calmar géant qui se réchauffait entre deux eaux.
HPfr16.txt-0019	calmar          	Les jumeaux Weasley chatouillaient les tentacules d’un calmar géant qui se réchauffait entre deux eaux.
HPfr16.txt-0020	étirer          	– Fini les révisions, soupira Ron avec bonheur en s’étirant dans l’herbe.
HPfr16.txt-0021	tranquillité    	Tu pourrais être plus joyeux, Harry, on a une semaine de tranquillité avant de savoir tout ce qu’on a fait de travers.
HPfr16.txt-0022	avertissement   	Je crois plutôt que c’est un avertissement.
HPfr16.txt-0023	parage          	Il n’y a rien à craindre pour la Pierre tant que Dumbledore est dans les parages.
HPfr16.txt-0024	malaise         	Mais Harry était convaincu que son sentiment de malaise n’avait rien à voir avec le travail.
HPfr16.txt-0025	écosser         	Il avait relevé ses manches et ses bas de pantalon et s’occupait à écosser des petits pois dans un grand bol.
HPfr16.txt-0026	bol             	Il avait relevé ses manches et ses bas de pantalon et s’occupait à écosser des petits pois dans un grand bol.
HPfr16.txt-0027	sanglier        	Il y a des tas de gens un peu bizarres à la Tête de Sanglier.
HPfr16.txt-0028	marchand        	Peut-être que c’était un marchand de dragons ?
HPfr16.txt-0029	courageusement  	– On veut voir le professeur Dumbledore, dit courageusement Hermione.
HPfr16.txt-0030	saugrenu        	– Voir le professeur Dumbledore ? répéta le professeur McGonagall, comme si elle trouvait l’idée particulièrement saugrenue.
HPfr16.txt-0031	habile          	Sa réponse n’était pas très habile, pensa-t-il en voyant le professeur McGonagall froncer le nez.
HPfr16.txt-0032	urgent          	Il a reçu un hibou urgent du ministère de la Magie et il s’est immédiatement envolé pour Londres.
HPfr16.txt-0033	méfiant         	Elle parut à la fois stupéfaite et méfiante.
HPfr16.txt-0034	veiller         	Si vous recommencez à vous promener la nuit dans les couloirs, je veillerai personnellement à ce que vous soyez renvoyé du collège.
HPfr16.txt-0035	personnellement 	Si vous recommencez à vous promener la nuit dans les couloirs, je veillerai personnellement à ce que vous soyez renvoyé du collège.
HPfr16.txt-0036	terriblement    	Oh, professeur, ajouta-t-il en prenant une voix haut perchée, je suis terriblement inquiète, j’ai peur d’avoir mal répondu à la question 14 b…
HPfr16.txt-0037	surveillance    	Elle accepta cependant d’assurer la surveillance de Rogue.
HPfr16.txt-0038	cahier          	Hermione parcourait ses cahiers de cours, espérant y dénicher le moyen de neutraliser les sortilèges qu’ils devraient affronter.
HPfr16.txt-0039	évader          	Neville apparut derrière un fauteuil en tenant contre lui son crapaud qui s’était à nouveau évadé.
HPfr16.txt-0040	balader         	– Vous allez encore vous balader ?
HPfr16.txt-0041	meuble          	Et il lâcha son crapaud qui disparut sous un meuble.
HPfr16.txt-0042	rigide          	Aussitôt, les bras de Neville se collèrent le long de ses flancs, ses jambes se joignirent, son corps devint rigide, il vacilla un instant, puis tomba en avant et resta immobile à plat ventre, raide comme une planche.
HPfr16.txt-0043	saucisson       	– C’est le maléfice du Saucisson, dit Hermione d’une voix navrée.
HPfr16.txt-0044	ligoter         	C’est comme s’il était ligoté et bâillonné.
HPfr16.txt-0045	bâillonner      	C’est comme s’il était ligoté et bâillonné.
HPfr16.txt-0046	présage         	Être obligés de laisser Neville dans cet état ne leur semblait pas un très bon présage.
HPfr16.txt-0047	pli             	Ils virent alors Peeves qui faisait des plis dans le tapis pour faire trébucher les gens.
HPfr16.txt-0048	gnome           	Gnomes, fantômes ou sales mômes ?
HPfr16.txt-0049	môme            	Gnomes, fantômes ou sales mômes ?
HPfr16.txt-0050	excellence      	– Je suis désolé, votre sanglante excellence, Monsieur le Baron, dit-il d’une voix onctueuse.
HPfr16.txt-0051	regrettable     	J’ai commis une erreur, une regrettable erreur, je ne vous avais pas vu.
HPfr16.txt-0052	entrebâiller    	Quelques secondes plus tard, ils s’étaient avancés dans le couloir et virent que la porte était entrebâillée.
HPfr16.txt-0053	harpe           	Ça ressemble à une harpe, dit Ron.
HPfr16.txt-0054	mélodie         	Ce n’était pas vraiment une mélodie, mais dès la première note, les paupières du monstre devinrent lourdes, il arrêta de grogner, ses jambes faiblirent, il trébucha puis s’effondra sur le sol, profondément endormi.
HPfr16.txt-0055	faiblir         	Ce n’était pas vraiment une mélodie, mais dès la première note, les paupières du monstre devinrent lourdes, il arrêta de grogner, ses jambes faiblirent, il trébucha puis s’effondra sur le sol, profondément endormi.
HPfr16.txt-0056	brûlant         	Lorsqu’ils approchèrent des trois têtes du chien, ils sentirent son souffle brûlant et fétide.
HPfr16.txt-0057	fétide          	Lorsqu’ils approchèrent des trois têtes du chien, ils sentirent son souffle brûlant et fétide.
HPfr16.txt-0058	pis             	– Bon, tant pis. Ron serra les dents, enjamba les pattes du chien avec précaution, puis tira l’anneau de la trappe qui se souleva sans difficulté et s’ouvrit.
HPfr16.txt-0059	angoisse        	– Qu’est-ce que tu vois ? demanda Hermione avec angoisse.
HPfr16.txt-0060	index           	Harry qui jouait toujours de la flûte fit un signe de la main à Ron et tapota sa poitrine de l’index.
HPfr16.txt-0061	replonger       	Lorsque la musique s’arrêta, le chien se remit à grogner et à bouger, mais dès qu’Hermione joua à nouveau, il replongea dans le sommeil.
HPfr16.txt-0062	faiblement      	La flûte qu’on entendait faiblement s’interrompit.
HPfr16.txt-0063	péniblement     	Elle se leva d’un bond et parvint péniblement à se réfugier contre une paroi humide.
HPfr16.txt-0064	vrille          	Péniblement, car dès l’instant où elle avait atterri, les vrilles de la plante, longues comme des tentacules, avaient commencé à s’enrouler autour de ses chevilles.
HPfr16.txt-0065	liane           	Quant à Ron et à Harry, des sortes de lianes leur avaient déjà ligoté les jambes sans qu’ils s’en rendent compte.
HPfr16.txt-0066	emprise         	Elle regarda avec horreur Harry et Ron qui se débattaient pour essayer de se libérer, mais plus ils tiraient sur les tentacules, plus l’emprise du monstre végétal se resserrait autour d’eux.
HPfr16.txt-0067	végétal         	Elle regarda avec horreur Harry et Ron qui se débattaient pour essayer de se libérer, mais plus ils tiraient sur les tentacules, plus l’emprise du monstre végétal se resserrait autour d’eux.
HPfr16.txt-0068	resserrer       	Elle regarda avec horreur Harry et Ron qui se débattaient pour essayer de se libérer, mais plus ils tiraient sur les tentacules, plus l’emprise du monstre végétal se resserrait autour d’eux.
HPfr16.txt-0069	étreindre       	– Alors, dépêche-toi, parce que j’ai du mal à respirer, dit Harry d’une voix haletante tandis que la plante lui étreignait la poitrine.
HPfr16.txt-0070	humidité        	Elle aime l’humidité et l’obscurité…
HPfr16.txt-0071	desserrer       	En quelques instants, Ron et Harry sentirent la plante desserrer son étreinte tandis qu’elle se recroquevillait sous l’effet de la chaleur et de la lumière.
HPfr16.txt-0072	liberté         	Ils retrouvèrent alors leur liberté de mouvement.
HPfr16.txt-0073	ruissellement   	Ils s’engagèrent alors dans ce passage qui s’enfonçait sous la terre, où l’on entendait que le doux ruissellement de gouttes d’eau sur les murs.
HPfr16.txt-0074	confus          	Venant d’un peu plus loin, on entendait un bruissement confus auquel se mêlaient quelques tintements.
HPfr16.txt-0075	tintement       	Venant d’un peu plus loin, on entendait un bruissement confus auquel se mêlaient quelques tintements.
HPfr16.txt-0076	brillamment     	Parvenus à l’extrémité du passage, ils découvrirent une salle brillamment éclairée, avec un haut plafond en forme d’arche.
HPfr16.txt-0077	profonde        	Il prit une profonde inspiration, se protégea la tête avec les bras et s’élança à travers la salle.
HPfr16.txt-0078	inspiration     	Il prit une profonde inspiration, se protégea la tête avec les bras et s’élança à travers la salle.
HPfr16.txt-0079	élancer         	Il prit une profonde inspiration, se protégea la tête avec les bras et s’élança à travers la salle.
HPfr16.txt-0080	rescousse       	Les deux autres vinrent à la rescousse, mais leurs efforts pour ouvrir la porte restèrent vains.
HPfr16.txt-0081	cerner          	– Il faut la cerner, cria Harry, sans quitter des yeux la clé à l’aile blessée.
HPfr16.txt-0082	paume           	Harry se pencha en avant et dans un craquement sinistre, il réussit à la plaquer contre la pierre avec la paume de la main.
HPfr16.txt-0083	seuil           	Mais lorsqu’ils eurent franchi le seuil de la porte, une lumière éclatante jaillit soudain en leur révélant un spectacle étonnant.
HPfr16.txt-0084	éclatant        	Mais lorsqu’ils eurent franchi le seuil de la porte, une lumière éclatante jaillit soudain en leur révélant un spectacle étonnant.
HPfr16.txt-0085	imposant        	Les pièces blanches, imposantes, n’avaient pas de visage.
HPfr16.txt-0086	casque          	Le cheval frappa l’échiquier de ses sabots et le cavalier tourna vers Ron sa tête coiffée d’un casque.
HPfr16.txt-0087	diagonale       	– Harry, déplace-toi de quatre cases en diagonale vers la droite.
HPfr16.txt-0088	reine           	La reine blanche l’assomma en le jetant à bas de sa monture et le traîna au bord de l’échiquier où il resta immobile, face contre terre.
HPfr16.txt-0089	monture         	La reine blanche l’assomma en le jetant à bas de sa monture et le traîna au bord de l’échiquier où il resta immobile, face contre terre.
HPfr16.txt-0090	sacrifice       	Il faut savoir faire des sacrifices !
HPfr16.txt-0091	mat             	Je vais jouer mon coup et elle me prendra, ce qui te permettra de faire échec et mat, Harry.
HPfr16.txt-0092	roi             	Aussitôt, le roi blanc ôta sa couronne et la jeta aux pieds de Harry.
HPfr16.txt-0093	couronne        	Aussitôt, le roi blanc ôta sa couronne et la jeta aux pieds de Harry.
HPfr16.txt-0094	répugnant       	Aussitôt, une répugnante odeur leur frappa les narines et tous deux durent relever les pans de leur robe pour se couvrir le nez.
HPfr16.txt-0095	bosse           	Il était évanoui, avec une grosse bosse sanglante sur le front.
HPfr16.txt-0096	abolir          	Deux sauront parmi nous conduire à la lumière, L’une d’entre les sept en avant te protège Et une autre en arrière abolira le piège, Deux ne pourront t’offrir que simple vin d’ortie Trois sont mortels poisons, promesse d’agonie, Choisis, si tu veux fuir un éternel supplice,
HPfr16.txt-0097	agonie          	Deux sauront parmi nous conduire à la lumière, L’une d’entre les sept en avant te protège Et une autre en arrière abolira le piège, Deux ne pourront t’offrir que simple vin d’ortie Trois sont mortels poisons, promesse d’agonie, Choisis, si tu veux fuir un éternel supplice,
HPfr16.txt-0098	éternel         	Deux sauront parmi nous conduire à la lumière, L’une d’entre les sept en avant te protège Et une autre en arrière abolira le piège, Deux ne pourront t’offrir que simple vin d’ortie Trois sont mortels poisons, promesse d’agonie, Choisis, si tu veux fuir un éternel supplice,
HPfr16.txt-0099	supplice        	Deux sauront parmi nous conduire à la lumière, L’une d’entre les sept en avant te protège Et une autre en arrière abolira le piège, Deux ne pourront t’offrir que simple vin d’ortie Trois sont mortels poisons, promesse d’agonie, Choisis, si tu veux fuir un éternel supplice,
HPfr16.txt-0100	rusé            	Le premier : si rusée que soit leur perfidie, Les poisons sont à gauche des deux vins d’ortie.
HPfr16.txt-0101	perfidie        	Le premier : si rusée que soit leur perfidie, Les poisons sont à gauche des deux vins d’ortie.
HPfr16.txt-0102	inégal          	Le troisième : elles sont de tailles inégales, Ni naine ni géante en son sein n’est fatale.
HPfr16.txt-0103	nain            	Le troisième : elles sont de tailles inégales, Ni naine ni géante en son sein n’est fatale.
HPfr16.txt-0104	sein            	Le troisième : elles sont de tailles inégales, Ni naine ni géante en son sein n’est fatale.
HPfr16.txt-0105	jumeler         	Quatre enfin : les deuxièmes, à gauche comme à droite, Sont jumelles de goût, mais d’aspect disparates.
HPfr16.txt-0106	disparate       	Quatre enfin : les deuxièmes, à gauche comme à droite, Sont jumelles de goût, mais d’aspect disparates.
HPfr16.txt-0107	soupir          	Hermione poussa un profond soupir et Harry fut stupéfait de voir qu’elle souriait.
HPfr16.txt-0108	logique         	Ce n’est pas de la magie, c’est de la logique.
HPfr16.txt-0109	énigme          	Une énigme.
HPfr16.txt-0110	goulot          	Elle but une longue gorgée au goulot de la bouteille ronde et fut parcourue d’un frisson.
HPfr16.txt-0111	angoissé        	demanda Harry d’une voix angoissée.
HPfr16.txt-0112	muscle          	Il reposa la bouteille, contracta ses muscles et s’avança à travers le feu.
